{
  "$schema": "https://json-schema.org/draft/2020-12/schema",
  "$id": "book.schema.json",
  "type": "object",
  "additionalProperties": false,
  "required": [
    "formatVersion",
    "id",
    "title",
    "titleJa",
    "author",
    "authorJa",
    "language",
    "description",
    "manifest"
  ],
  "properties": {
    "formatVersion": { "const": 1 },
    "id": { "type": "string", "pattern": "^[a-z0-9-]+$" },
    "title": { "type": "string", "minLength": 1 },
    "titleJa": { "type": "string", "minLength": 1 },
    "author": { "type": "string", "minLength": 1 },
    "authorJa": { "type": "string", "minLength": 1 },
    "language": { "enum": ["ja", "en", "mixed"] },
    "description": { "type": "string", "minLength": 1 },
    "manifest": { "type": "string", "pattern": "^[^/].*\\.json$" }
  }
}
